{
  "as_of_date": "2026-08-10",
  "audit_coverage": {
    "audit_backed_in_canonical_universe_count": 7,
    "audit_backed_in_effective_universe_count": 7,
    "audit_backed_in_universe_count": 7,
    "audit_company_ids": [
      "daeseung-engineering",
      "geogwang-enterprise",
      "kumkang-kind",
      "nrb",
      "planm",
      "sungji-steel",
      "yuchang-enc"
    ],
    "audit_company_ids_not_in_universe": [],
    "audit_record_count": 7,
    "full_three_year_audit_in_canonical_universe_count": 7,
    "full_three_year_audit_in_effective_universe_count": 7,
    "full_three_year_audit_in_universe_count": 7,
    "full_three_year_audit_record_count": 7,
    "state_counts": {
      "complete": 5,
      "unavailable": 4,
      "verification_pending": 2
    }
  },
  "companies": [
    {
      "accounting_standard": {
        "code": "korean_gaap",
        "label_en": "Korean GAAP",
        "label_ko": "일반기업회계기준"
      },
      "audit_coverage_state": "complete",
      "audit_financials_available": true,
      "audit_latest_report_date": "2025-09-17",
      "audit_years": [
        2023,
        2024,
        2025
      ],
      "company_id": "daeseung-engineering",
      "company_master_present": true,
      "company_name": "대승엔지니어링",
      "company_profile_present": true,
      "company_profile_verified_at": "2026-07-19T00:00:00+09:00",
      "company_record_source": "canonical",
      "evidence_coverage_state": "sparse",
      "financial_scope": "standalone",
      "freshness_state": "current",
      "headquarters_present": true,
      "latest_audit_year": 2025,
      "latest_report_date": "2025-09-17",
      "manual_page_check_count": 0,
      "not_disclosed_count": 0,
      "oldest_critical_verification_date": "2025-09-17",
      "operational_coverage_state": "sufficiently_covered",
      "optional_metric_coverage": {
        "current_assets": {
          "by_year": {
            "2023": "reported",
            "2024": "reported",
            "2025": "reported"
          },
          "missing": 0,
          "not_applicable": 0,
          "not_disclosed": 0,
          "reported": 3,
          "verification_pending": 0
        },
        "current_liabilities": {
          "by_year": {
            "2023": "reported",
            "2024": "reported",
            "2025": "reported"
          },
          "missing": 0,
          "not_applicable": 0,
          "not_disclosed": 0,
          "reported": 3,
          "verification_pending": 0
        },
        "inventory": {
          "by_year": {
            "2023": "reported",
            "2024": "reported",
            "2025": "reported"
          },
          "missing": 0,
          "not_applicable": 0,
          "not_disclosed": 0,
          "reported": 3,
          "verification_pending": 0
        },
        "work_in_progress": {
          "by_year": {
            "2023": "missing",
            "2024": "missing",
            "2025": "missing"
          },
          "missing": 3,
          "not_applicable": 0,
          "not_disclosed": 0,
          "reported": 0,
          "verification_pending": 0
        }
      },
      "pending_source_count": 0,
      "production_capacity_available": false,
      "production_facility_count": 2,
      "production_freshness_state": "current",
      "production_verified_at": "2026-07-19",
      "project_count": 2,
      "project_freshness_state": "current",
      "project_verified_at": "2026-07-19",
      "recommendation_priority": "P2",
      "recommendation_reason_codes": [
        "source_coverage_sparse"
      ],
      "recommended_next_action": "source_registry_review",
      "recommended_next_domain": "evidence",
      "representative_present": true,
      "required_metric_coverage": {
        "gross_profit": {
          "by_year": {
            "2023": "reported",
            "2024": "reported",
            "2025": "reported"
          },
          "missing": 0,
          "not_applicable": 0,
          "not_disclosed": 0,
          "reported": 3,
          "verification_pending": 0
        },
        "net_income": {
          "by_year": {
            "2023": "reported",
            "2024": "reported",
            "2025": "reported"
          },
          "missing": 0,
          "not_applicable": 0,
          "not_disclosed": 0,
          "reported": 3,
          "verification_pending": 0
        },
        "operating_cash_flow": {
          "by_year": {
            "2023": "reported",
            "2024": "reported",
            "2025": "reported"
          },
          "missing": 0,
          "not_applicable": 0,
          "not_disclosed": 0,
          "reported": 3,
          "verification_pending": 0
        },
        "operating_profit": {
          "by_year": {
            "2023": "reported",
            "2024": "reported",
            "2025": "reported"
          },
          "missing": 0,
          "not_applicable": 0,
          "not_disclosed": 0,
          "reported": 3,
          "verification_pending": 0
        },
        "receivables_total": {
          "by_year": {
            "2023": "reported",
            "2024": "reported",
            "2025": "reported"
          },
          "missing": 0,
          "not_applicable": 0,
          "not_disclosed": 0,
          "reported": 3,
          "verification_pending": 0
        },
        "revenue": {
          "by_year": {
            "2023": "reported",
            "2024": "reported",
            "2025": "reported"
          },
          "missing": 0,
          "not_applicable": 0,
          "not_disclosed": 0,
          "reported": 3,
          "verification_pending": 0
        },
        "total_assets": {
          "by_year": {
            "2023": "reported",
            "2024": "reported",
            "2025": "reported"
          },
          "missing": 0,
          "not_applicable": 0,
          "not_disclosed": 0,
          "reported": 3,
          "verification_pending": 0
        },
        "total_borrowings": {
          "by_year": {
            "2023": "reported",
            "2024": "reported",
            "2025": "reported"
          },
          "missing": 0,
          "not_applicable": 0,
          "not_disclosed": 0,
          "reported": 3,
          "verification_pending": 0
        },
        "total_equity": {
          "by_year": {
            "2023": "reported",
            "2024": "reported",
            "2025": "reported"
          },
          "missing": 0,
          "not_applicable": 0,
          "not_disclosed": 0,
          "reported": 3,
          "verification_pending": 0
        },
        "total_liabilities": {
          "by_year": {
            "2023": "reported",
            "2024": "reported",
            "2025": "reported"
          },
          "missing": 0,
          "not_applicable": 0,
          "not_disclosed": 0,
          "reported": 3,
          "verification_pending": 0
        }
      },
      "source_count": 6,
      "source_document_count": 3,
      "technology_count": 1,
      "technology_freshness_state": "current",
      "technology_verified_at": "2026-07-19",
      "verification_pending_count": 0,
      "verified_production_facility_count": 0,
      "verified_project_count": 2,
      "verified_source_count": 0,
      "verified_technology_count": 1,
      "website_present": false
    },
    {
      "accounting_standard": null,
      "audit_coverage_state": "unavailable",
      "audit_financials_available": false,
      "audit_latest_report_date": null,
      "audit_years": [],
      "company_id": "dl-enc",
      "company_master_present": true,
      "company_name": "DL이앤씨",
      "company_profile_present": true,
      "company_profile_verified_at": "2026-07-16T22:30:00+09:00",
      "company_record_source": "canonical",
      "evidence_coverage_state": "verified",
      "financial_scope": null,
      "freshness_state": "current",
      "headquarters_present": true,
      "latest_audit_year": null,
      "latest_report_date": null,
      "manual_page_check_count": 0,
      "not_disclosed_count": 0,
      "oldest_critical_verification_date": "2026-07-16",
      "operational_coverage_state": "sufficiently_covered",
      "optional_metric_coverage": {
        "current_assets": {
          "by_year": {},
          "missing": 0,
          "not_applicable": 0,
          "not_disclosed": 0,
          "reported": 0,
          "verification_pending": 0
        },
        "current_liabilities": {
          "by_year": {},
          "missing": 0,
          "not_applicable": 0,
          "not_disclosed": 0,
          "reported": 0,
          "verification_pending": 0
        },
        "inventory": {
          "by_year": {},
          "missing": 0,
          "not_applicable": 0,
          "not_disclosed": 0,
          "reported": 0,
          "verification_pending": 0
        },
        "work_in_progress": {
          "by_year": {},
          "missing": 0,
          "not_applicable": 0,
          "not_disclosed": 0,
          "reported": 0,
          "verification_pending": 0
        }
      },
      "pending_source_count": 0,
      "production_capacity_available": false,
      "production_facility_count": 0,
      "production_freshness_state": "unknown",
      "production_verified_at": null,
      "project_count": 2,
      "project_freshness_state": "current",
      "project_verified_at": "2026-07-16",
      "recommendation_priority": "P1",
      "recommendation_reason_codes": [
        "missing_audit_financials"
      ],
      "recommended_next_action": "audit_report_onboarding",
      "recommended_next_domain": "financial",
      "representative_present": true,
      "required_metric_coverage": {
        "gross_profit": {
          "by_year": {},
          "missing": 0,
          "not_applicable": 0,
          "not_disclosed": 0,
          "reported": 0,
          "verification_pending": 0
        },
        "net_income": {
          "by_year": {},
          "missing": 0,
          "not_applicable": 0,